{
  "schemaVersion": "1.0.0",
  "eventId": "brevt_000000000000000000000002",
  "type": "bridge.capability.changed",
  "timestamp": "2026-06-23T16:00:00.030Z",
  "payload": {
    "capability": {
      "id": "system.metrics",
      "available": false,
      "source": "unavailable",
      "degradedReason": "Live system metrics are unavailable in this fixture."
    }
  }
}
